{
  "checks": [
    {
      "expected": null,
      "id": "macro.no_duplicates",
      "message": "6 observations with unique keys",
      "observed": null,
      "outcome": "PASS",
      "severity": "CRITICAL",
      "subject": null
    },
    {
      "expected": null,
      "id": "macro.registered_only",
      "message": "only registered model series were collected",
      "observed": null,
      "outcome": "PASS",
      "severity": "CRITICAL",
      "subject": null
    },
    {
      "expected": null,
      "id": "macro.publication_date",
      "message": "every published observation carries a publication date",
      "observed": null,
      "outcome": "PASS",
      "severity": "WARNING",
      "subject": null
    },
    {
      "expected": null,
      "id": "data.missing_vs_zero",
      "message": "6 records: every null carries a reason and no value contradicts one",
      "observed": null,
      "outcome": "PASS",
      "severity": "INFO",
      "subject": null
    }
  ],
  "counts": {
    "filesChanged": 0,
    "recordsIn": 6,
    "recordsInvalid": 0,
    "recordsMissing": 1,
    "recordsValid": 5,
    "recordsWritten": 6,
    "tickersFailed": 0,
    "tickersSucceeded": 0
  },
  "failedTickers": [],
  "generatedAt": "2026-07-30T09:48:54Z",
  "notPromotedReason": null,
  "promoted": true,
  "runId": "gdt-macro-update-20260730T094854Z",
  "schemaVersion": "1.0.0",
  "sources": [
    {
      "enabled": false,
      "lastSuccessAt": null,
      "providerId": "bank_indonesia",
      "rightsStatus": "MANUAL_REVIEW_REQUIRED",
      "staleDays": null
    },
    {
      "enabled": false,
      "lastSuccessAt": null,
      "providerId": "bps",
      "rightsStatus": "MANUAL_REVIEW_REQUIRED",
      "staleDays": null
    },
    {
      "enabled": true,
      "lastSuccessAt": "2026-07-30T09:22:53Z",
      "providerId": "fixture_disclosures",
      "rightsStatus": "PUBLIC_METADATA_ONLY",
      "staleDays": null
    },
    {
      "enabled": true,
      "lastSuccessAt": "2026-07-30T09:33:14Z",
      "providerId": "fixture_financials",
      "rightsStatus": "PUBLIC_DERIVED_OUTPUT_APPROVED",
      "staleDays": null
    },
    {
      "enabled": true,
      "lastSuccessAt": "2026-07-30T09:22:52Z",
      "providerId": "fixture_idx30_registry",
      "rightsStatus": "PUBLIC_METADATA_ONLY",
      "staleDays": null
    },
    {
      "enabled": true,
      "lastSuccessAt": "2026-07-30T09:22:54Z",
      "providerId": "fixture_macro",
      "rightsStatus": "PUBLIC_METADATA_ONLY",
      "staleDays": null
    },
    {
      "enabled": true,
      "lastSuccessAt": null,
      "providerId": "fixture_market_prices",
      "rightsStatus": "PRIVATE_RESEARCH_ONLY",
      "staleDays": null
    },
    {
      "enabled": false,
      "lastSuccessAt": null,
      "providerId": "idx_disclosures",
      "rightsStatus": "MANUAL_REVIEW_REQUIRED",
      "staleDays": null
    },
    {
      "enabled": false,
      "lastSuccessAt": null,
      "providerId": "idx_financials",
      "rightsStatus": "MANUAL_REVIEW_REQUIRED",
      "staleDays": null
    },
    {
      "enabled": false,
      "lastSuccessAt": null,
      "providerId": "idx_index_constituents",
      "rightsStatus": "MANUAL_REVIEW_REQUIRED",
      "staleDays": null
    },
    {
      "enabled": false,
      "lastSuccessAt": null,
      "providerId": "idx_market_prices",
      "rightsStatus": "MANUAL_REVIEW_REQUIRED",
      "staleDays": null
    },
    {
      "enabled": false,
      "lastSuccessAt": null,
      "providerId": "ojk",
      "rightsStatus": "MANUAL_REVIEW_REQUIRED",
      "staleDays": null
    }
  ],
  "status": "PASS",
  "workflow": "gdt-macro-update",
  "writeMode": "commit"
}
