{
  "checks": [
    {
      "expected": null,
      "id": "registry.ticker_unique",
      "message": "30 unique tickers",
      "observed": null,
      "outcome": "PASS",
      "severity": "CRITICAL",
      "subject": null
    },
    {
      "expected": null,
      "id": "registry.name_present",
      "message": "every constituent has a name",
      "observed": null,
      "outcome": "PASS",
      "severity": "CRITICAL",
      "subject": null
    },
    {
      "expected": null,
      "id": "registry.nonempty",
      "message": "source returned 30 constituents",
      "observed": null,
      "outcome": "PASS",
      "severity": "CRITICAL",
      "subject": null
    },
    {
      "expected": null,
      "id": "schema.idx30",
      "message": "document conforms to idx30.schema.json",
      "observed": null,
      "outcome": "PASS",
      "severity": "CRITICAL",
      "subject": "idx30.current.json"
    },
    {
      "expected": null,
      "id": "universe.ticker_unique",
      "message": "all 30 tickers are unique",
      "observed": 30,
      "outcome": "PASS",
      "severity": "INFO",
      "subject": null
    },
    {
      "expected": 30,
      "id": "universe.count_matches_source",
      "message": "active constituents (30) matches the count declared by the source (30)",
      "observed": 30,
      "outcome": "PASS",
      "severity": "CRITICAL",
      "subject": null
    },
    {
      "expected": null,
      "id": "universe.count_conventional",
      "message": "active count is 30",
      "observed": 30,
      "outcome": "PASS",
      "severity": "INFO",
      "subject": null
    },
    {
      "expected": null,
      "id": "universe.effective_range",
      "message": "effective range 2026-02-02 → current",
      "observed": null,
      "outcome": "PASS",
      "severity": "INFO",
      "subject": null
    },
    {
      "expected": null,
      "id": "universe.entered_within_range",
      "message": "all enteredAt dates fall within the effective period",
      "observed": null,
      "outcome": "PASS",
      "severity": "INFO",
      "subject": null
    },
    {
      "expected": null,
      "id": "universe.model_mapping",
      "message": "all 30 constituents have a coherent model/coverage pairing",
      "observed": null,
      "outcome": "PASS",
      "severity": "INFO",
      "subject": null
    },
    {
      "expected": null,
      "id": "universe.onboarding",
      "message": "no constituents are awaiting a model",
      "observed": [],
      "outcome": "PASS",
      "severity": "INFO",
      "subject": null
    },
    {
      "expected": null,
      "id": "schema.company",
      "message": "document conforms to company.schema.json",
      "observed": null,
      "outcome": "PASS",
      "severity": "CRITICAL",
      "subject": "companies.json"
    }
  ],
  "counts": {
    "filesChanged": 2,
    "recordsIn": 30,
    "recordsInvalid": 0,
    "recordsMissing": 0,
    "recordsValid": 30,
    "recordsWritten": 30,
    "tickersFailed": 0,
    "tickersSucceeded": 30
  },
  "failedTickers": [],
  "generatedAt": "2026-07-31T07:28:37Z",
  "notPromotedReason": null,
  "promoted": true,
  "runId": "gdt-registry-update-20260731T072837Z",
  "schemaVersion": "1.0.0",
  "sources": [
    {
      "enabled": false,
      "lastSuccessAt": null,
      "providerId": "bank_indonesia",
      "rightsStatus": "MANUAL_REVIEW_REQUIRED",
      "staleDays": null
    },
    {
      "enabled": false,
      "lastSuccessAt": null,
      "providerId": "bps",
      "rightsStatus": "MANUAL_REVIEW_REQUIRED",
      "staleDays": null
    },
    {
      "enabled": true,
      "lastSuccessAt": "2026-07-30T09:22:53Z",
      "providerId": "fixture_disclosures",
      "rightsStatus": "PUBLIC_METADATA_ONLY",
      "staleDays": null
    },
    {
      "enabled": true,
      "lastSuccessAt": "2026-07-30T09:33:14Z",
      "providerId": "fixture_financials",
      "rightsStatus": "PUBLIC_DERIVED_OUTPUT_APPROVED",
      "staleDays": null
    },
    {
      "enabled": true,
      "lastSuccessAt": "2026-07-30T09:22:52Z",
      "providerId": "fixture_idx30_registry",
      "rightsStatus": "PUBLIC_METADATA_ONLY",
      "staleDays": null
    },
    {
      "enabled": true,
      "lastSuccessAt": "2026-07-30T09:22:54Z",
      "providerId": "fixture_macro",
      "rightsStatus": "PUBLIC_METADATA_ONLY",
      "staleDays": null
    },
    {
      "enabled": true,
      "lastSuccessAt": null,
      "providerId": "fixture_market_prices",
      "rightsStatus": "PRIVATE_RESEARCH_ONLY",
      "staleDays": null
    },
    {
      "enabled": false,
      "lastSuccessAt": null,
      "providerId": "idx_disclosures",
      "rightsStatus": "MANUAL_REVIEW_REQUIRED",
      "staleDays": null
    },
    {
      "enabled": false,
      "lastSuccessAt": null,
      "providerId": "idx_financials",
      "rightsStatus": "MANUAL_REVIEW_REQUIRED",
      "staleDays": null
    },
    {
      "enabled": false,
      "lastSuccessAt": null,
      "providerId": "idx_index_constituents",
      "rightsStatus": "MANUAL_REVIEW_REQUIRED",
      "staleDays": null
    },
    {
      "enabled": false,
      "lastSuccessAt": null,
      "providerId": "idx_market_prices",
      "rightsStatus": "MANUAL_REVIEW_REQUIRED",
      "staleDays": null
    },
    {
      "enabled": false,
      "lastSuccessAt": null,
      "providerId": "ojk",
      "rightsStatus": "MANUAL_REVIEW_REQUIRED",
      "staleDays": null
    }
  ],
  "status": "PASS",
  "workflow": "gdt-registry-update",
  "writeMode": "commit"
}
