{
  "checks": [
    {
      "expected": null,
      "id": "disclosures.stable_id_unique",
      "message": "5 unique disclosure ids",
      "observed": null,
      "outcome": "PASS",
      "severity": "CRITICAL",
      "subject": null
    },
    {
      "expected": null,
      "id": "disclosures.no_stored_documents",
      "message": "no disclosure stores its source document in the repository",
      "observed": null,
      "outcome": "PASS",
      "severity": "CRITICAL",
      "subject": null
    },
    {
      "expected": null,
      "id": "disclosures.official_url",
      "message": "every disclosure links to its official source",
      "observed": null,
      "outcome": "PASS",
      "severity": "CRITICAL",
      "subject": null
    },
    {
      "expected": null,
      "id": "disclosures.unconfirmed_events",
      "message": "1 disclosures are below OFFICIAL_DECISION and must not be rendered as fact: ['FIX-DISC-2026-0005']",
      "observed": null,
      "outcome": "FAIL",
      "severity": "WARNING",
      "subject": null
    },
    {
      "expected": 0,
      "id": "schema.disclosure.summary",
      "message": "5/5 records conform to disclosure.schema.json",
      "observed": 0,
      "outcome": "PASS",
      "severity": "INFO",
      "subject": null
    },
    {
      "expected": 0,
      "id": "data.no_duplicates",
      "message": "no duplicate keys across 5 records on ('disclosureId',)",
      "observed": 0,
      "outcome": "PASS",
      "severity": "INFO",
      "subject": null
    }
  ],
  "counts": {
    "filesChanged": 0,
    "recordsIn": 5,
    "recordsInvalid": 0,
    "recordsMissing": 0,
    "recordsValid": 5,
    "recordsWritten": 5,
    "tickersFailed": 0,
    "tickersSucceeded": 0
  },
  "failedTickers": [],
  "generatedAt": "2026-07-30T09:48:54Z",
  "notPromotedReason": null,
  "promoted": true,
  "runId": "gdt-disclosure-watch-20260730T094854Z",
  "schemaVersion": "1.0.0",
  "sources": [
    {
      "enabled": false,
      "lastSuccessAt": null,
      "providerId": "bank_indonesia",
      "rightsStatus": "MANUAL_REVIEW_REQUIRED",
      "staleDays": null
    },
    {
      "enabled": false,
      "lastSuccessAt": null,
      "providerId": "bps",
      "rightsStatus": "MANUAL_REVIEW_REQUIRED",
      "staleDays": null
    },
    {
      "enabled": true,
      "lastSuccessAt": "2026-07-30T09:22:53Z",
      "providerId": "fixture_disclosures",
      "rightsStatus": "PUBLIC_METADATA_ONLY",
      "staleDays": null
    },
    {
      "enabled": true,
      "lastSuccessAt": "2026-07-30T09:33:14Z",
      "providerId": "fixture_financials",
      "rightsStatus": "PUBLIC_DERIVED_OUTPUT_APPROVED",
      "staleDays": null
    },
    {
      "enabled": true,
      "lastSuccessAt": "2026-07-30T09:22:52Z",
      "providerId": "fixture_idx30_registry",
      "rightsStatus": "PUBLIC_METADATA_ONLY",
      "staleDays": null
    },
    {
      "enabled": true,
      "lastSuccessAt": "2026-07-30T09:22:54Z",
      "providerId": "fixture_macro",
      "rightsStatus": "PUBLIC_METADATA_ONLY",
      "staleDays": null
    },
    {
      "enabled": true,
      "lastSuccessAt": null,
      "providerId": "fixture_market_prices",
      "rightsStatus": "PRIVATE_RESEARCH_ONLY",
      "staleDays": null
    },
    {
      "enabled": false,
      "lastSuccessAt": null,
      "providerId": "idx_disclosures",
      "rightsStatus": "MANUAL_REVIEW_REQUIRED",
      "staleDays": null
    },
    {
      "enabled": false,
      "lastSuccessAt": null,
      "providerId": "idx_financials",
      "rightsStatus": "MANUAL_REVIEW_REQUIRED",
      "staleDays": null
    },
    {
      "enabled": false,
      "lastSuccessAt": null,
      "providerId": "idx_index_constituents",
      "rightsStatus": "MANUAL_REVIEW_REQUIRED",
      "staleDays": null
    },
    {
      "enabled": false,
      "lastSuccessAt": null,
      "providerId": "idx_market_prices",
      "rightsStatus": "MANUAL_REVIEW_REQUIRED",
      "staleDays": null
    },
    {
      "enabled": false,
      "lastSuccessAt": null,
      "providerId": "ojk",
      "rightsStatus": "MANUAL_REVIEW_REQUIRED",
      "staleDays": null
    }
  ],
  "status": "PASS_WITH_WARNINGS",
  "workflow": "gdt-disclosure-watch",
  "writeMode": "commit"
}
