{
  "checks": [
    {
      "expected": null,
      "id": "facts.no_duplicates",
      "message": "22 facts with unique (factKey, revision)",
      "observed": null,
      "outcome": "PASS",
      "severity": "CRITICAL",
      "subject": null
    },
    {
      "expected": null,
      "id": "facts.zero_is_real",
      "message": "no zero-valued facts to disambiguate",
      "observed": null,
      "outcome": "PASS",
      "severity": "WARNING",
      "subject": null
    },
    {
      "expected": null,
      "id": "facts.missing_has_reason",
      "message": "every missing fact carries a reason",
      "observed": null,
      "outcome": "PASS",
      "severity": "CRITICAL",
      "subject": null
    },
    {
      "expected": null,
      "id": "facts.balance_sheet_identity",
      "message": "balance-sheet identity holds for 1 complete periods",
      "observed": null,
      "outcome": "PASS",
      "severity": "INFO",
      "subject": null
    },
    {
      "expected": 0,
      "id": "schema.financial-fact.summary",
      "message": "22/22 records conform to financial-fact.schema.json",
      "observed": 0,
      "outcome": "PASS",
      "severity": "INFO",
      "subject": null
    },
    {
      "expected": null,
      "id": "data.missing_vs_zero",
      "message": "22 records: every null carries a reason and no value contradicts one",
      "observed": null,
      "outcome": "PASS",
      "severity": "INFO",
      "subject": null
    },
    {
      "expected": 0,
      "id": "data.no_duplicates",
      "message": "no duplicate keys across 22 records on ('factKey', 'revision')",
      "observed": 0,
      "outcome": "PASS",
      "severity": "INFO",
      "subject": null
    }
  ],
  "counts": {
    "filesChanged": 0,
    "recordsIn": 22,
    "recordsInvalid": 0,
    "recordsMissing": 2,
    "recordsValid": 20,
    "recordsWritten": 22,
    "tickersFailed": 0,
    "tickersSucceeded": 3
  },
  "failedTickers": [],
  "generatedAt": "2026-07-30T09:48:54Z",
  "notPromotedReason": null,
  "promoted": true,
  "runId": "gdt-financial-update-20260730T094854Z",
  "schemaVersion": "1.0.0",
  "sources": [
    {
      "enabled": false,
      "lastSuccessAt": null,
      "providerId": "bank_indonesia",
      "rightsStatus": "MANUAL_REVIEW_REQUIRED",
      "staleDays": null
    },
    {
      "enabled": false,
      "lastSuccessAt": null,
      "providerId": "bps",
      "rightsStatus": "MANUAL_REVIEW_REQUIRED",
      "staleDays": null
    },
    {
      "enabled": true,
      "lastSuccessAt": "2026-07-30T09:22:53Z",
      "providerId": "fixture_disclosures",
      "rightsStatus": "PUBLIC_METADATA_ONLY",
      "staleDays": null
    },
    {
      "enabled": true,
      "lastSuccessAt": "2026-07-30T09:33:14Z",
      "providerId": "fixture_financials",
      "rightsStatus": "PUBLIC_DERIVED_OUTPUT_APPROVED",
      "staleDays": null
    },
    {
      "enabled": true,
      "lastSuccessAt": "2026-07-30T09:22:52Z",
      "providerId": "fixture_idx30_registry",
      "rightsStatus": "PUBLIC_METADATA_ONLY",
      "staleDays": null
    },
    {
      "enabled": true,
      "lastSuccessAt": "2026-07-30T09:22:54Z",
      "providerId": "fixture_macro",
      "rightsStatus": "PUBLIC_METADATA_ONLY",
      "staleDays": null
    },
    {
      "enabled": true,
      "lastSuccessAt": null,
      "providerId": "fixture_market_prices",
      "rightsStatus": "PRIVATE_RESEARCH_ONLY",
      "staleDays": null
    },
    {
      "enabled": false,
      "lastSuccessAt": null,
      "providerId": "idx_disclosures",
      "rightsStatus": "MANUAL_REVIEW_REQUIRED",
      "staleDays": null
    },
    {
      "enabled": false,
      "lastSuccessAt": null,
      "providerId": "idx_financials",
      "rightsStatus": "MANUAL_REVIEW_REQUIRED",
      "staleDays": null
    },
    {
      "enabled": false,
      "lastSuccessAt": null,
      "providerId": "idx_index_constituents",
      "rightsStatus": "MANUAL_REVIEW_REQUIRED",
      "staleDays": null
    },
    {
      "enabled": false,
      "lastSuccessAt": null,
      "providerId": "idx_market_prices",
      "rightsStatus": "MANUAL_REVIEW_REQUIRED",
      "staleDays": null
    },
    {
      "enabled": false,
      "lastSuccessAt": null,
      "providerId": "ojk",
      "rightsStatus": "MANUAL_REVIEW_REQUIRED",
      "staleDays": null
    }
  ],
  "status": "PASS",
  "workflow": "gdt-financial-update",
  "writeMode": "commit"
}
